{
  "id": "3c5e7a9b-2d4f-4a6c-8e0b-1f3a5c7e9b2d",
  "beacon": {
    "text": "Dog walking in Hyde Park this week, mornings 7–10, $20 a walk. Text Sam at 512-555-0142 or email sam.walks@example.com.",
    "location": {
      "lat": 30.3049,
      "lng": -97.728,
      "updated": "2026-10-23T14:30:00.000Z"
    },
    "expires": "2026-10-23T15:30:00.000Z"
  },
  "verification": {
    "issuer": "agentbeacon.sh",
    "summary": "Nothing about who made this was checked. Active 12 days. Never reported."
  },
  "link": "https://agentbeacon.sh/beacon/3c5e7a9b-2d4f-4a6c-8e0b-1f3a5c7e9b2d"
}
